Published Date,Published Time,Saved Date,Edited Date,Timezone,Author,Outlet,Headline,Coverage Snippet,Contextual Snippet,Insight Name,Insight,URL,Image URLs,Attribution,Media Type,Classification,Sentiment,Language,Translated Language,AVE(USD),Impressions,Domain Authority,Word Count,Duration,Continent,Country,Province/State,County,City
1/16/2025,3:26:02 PM,,,UTC,kinnisvarauudised.ee,Kinnisvarauudised.ee,Estateguru juht ennustab investorite aktiivsuse kasvu,"Väikeinvestori jaoks ei ole aastal 2025 lihtne leida ühisrahastusega sarnast tootlust, kinnitab Estateguru juht Mihkel Stamm. Estateguru juht Mihkel Stamm. Foto: Andras Kralla Kinnisvara tagatisel laene vahendava Estateguru platvormi investoritele...","27.11.24, 15:14
Kapitel avas 160-miljonilise Arteri kvartali

Tänasest on Tallinna kesklinnas avatud Arteri kvartal, kus on kokku 44 000 m² üüripinda ning mille koguinvesteering on üle 160 miljoni euro. Kvartali arhitekt on Martin Aunin, sisearhitekt",,,http://ct.moreover.com/?a=55788282386&p=1lk&v=1&x=aYbo8lN6AeS1EvV2vyv-nQ,"https://static-img.aripaev.ee/?type=preview&uuid=07fbf84b-fa2c-54f4-80d1-981ccaadc44a&width=600&q=85,https://static-img.aripaev.ee/?type=preview&uuid=07fbf84b-fa2c-54f4-80d1-981ccaadc44a&width=1200&q=85",,ONLINE_NEWS,,NOT AVAILABLE,Estonian,,,,,256,,Europe,Estonia,,,
1/14/2025,4:01:22 PM,,,UTC,,Adaur.ee - Esileht,Kaamos: Kaamos sisenes Läti ärikinnisvaraturule Veho Mercedes-Benzi keskusega,"Adaur.ee Eesti kapitalil Kaamos Kinnisvara laiendas oma senist tegevust Läti turule, avades sealse esimese süsinikuneutraalse ärikondliku kinnisvaraobjekti Mercedes-Benz/Veho teeninduskeskuse Riia Mārupe linnaosas. Ehitustööd kestsid kaheksa kuud, tööd...","Hoolimata ehitusturu väljakutsetest püsib Eesti üks suurimaid ehitusprojekte ajagraafikus ning valm

21.10.2022 Kapitel: Arter kvartali korterhotelli hakkab opereerima rahvusvaheline majutusettevõte Bob W

Tallinna kesklinna kerkiva Arter kvartali 9-...",,,https://www.adaur.ee/kaamos-kaamos-sisenes-lati-arikinnisvaraturule-veho-mercedes-benzi-keskusega/,https://www.adaur.ee/wp-content/2021/11/Kaamos-300x157.png,,ONLINE_NEWS,,NOT AVAILABLE,Estonian,,,,,397,,Europe,Estonia,,,
1/6/2025,8:26:09 AM,,,UTC,kinnisvarauudised.ee,Kinnisvarauudised.ee,Kapitel sai Arterisse rentnikuks olulise advokaadibüroo,"“Meie eesmärk on väga kvaliteetse töökeskkonna pakkumine, mida iseloomustab büroopindadel esmaklassiline sisekliima, õhuniisutus. Meie standard on kõikidel büroopindadel tõstetud põrandad, mis võimaldavad üürnikel vajadusel kiirelt ja mugavalt oma...",,,,http://ct.moreover.com/?a=55708517620&p=1lk&v=1&x=o8y6o71QDlCUtkCMjBfmLg,"https://static-img.aripaev.ee/?type=preview&uuid=e5a6a3e0-e766-5a2f-a76b-f06d35589e71&width=1200&q=85,https://static-img.aripaev.ee/?type=preview&uuid=e5a6a3e0-e766-5a2f-a76b-f06d35589e71&width=600&q=85",,ONLINE_NEWS,,NOT AVAILABLE,Estonian,,,,,95,,Europe,Estonia,,,
