"Published Date","Published Time","Saved Date","Edited Date",Timezone,Author,Outlet,Headline,"Coverage Snippet","Contextual Snippet","Insight Name",Insight,URL,"Image URLs",Attribution,"Media Type",Classification,Sentiment,Language,"Translated Language",AVE(USD),Impressions,"Domain Authority","Word Count",Duration,Continent,Country,Province/State,County,City
01/29/2025,"04:02:34 AM",,,UTC,"Siim Sultson",Kinnisvarauudised.ee,"Valmistu muutma hoone otstarvet või hääbu - ärikinnisvara saab uue näo","Järgmised paar aastat keeravad elavneval ärikinnisvaraturul mitu senist trendi pea peale. Investoritel kujuneb uus suund. Kolm tunnustatud valdkonna eksperti avavad perspektiive - huviline, vaata, et Sa rongist maha ei jää. Uut arendada on ikka tore -...","Nädala tagasi teatas Leedu logistikahiid SIRIN Development, et 12 miljonit eurot maksnud ja 14 000 ruutmeetri suurune SIRIN PARK TÄNASSILMA on üürnikele avatud. See on suurinvestori Eestisse ambitsioonika investeerimiskava stardipauk. Järgneva viie-k...",,,"https://www.kinnisvarauudised.ee/uudised/2025/01/28/valmistu-muutma-hoone-otstarvet-voi-haabu-arikinnisvara-saab-uue-nao",,,ONLINE_NEWS,,"NOT AVAILABLE",Estonian,,,,,183,,Europe,Estonia,,,
01/28/2025,"01:51:26 PM",,,UTC,kinnisvarauudised.ee,Kinnisvarauudised.ee,"Eesti majandus hakkab lõpuks kasvama","SEB majandusanalüütik Mihkel Nestor (Foto: SEB). Ka 2025. aastal ootab eestlasi tubli palgakasv; laenu võtnud inimestele on abiks intressimäärade langus, mis võimaldab laenumaksete tegemise kõrvalt suurendada tarbimist või säästmist, kirjutab SEB...","SIRIN Developmenti tegevjuhi Laurynas Kuzavas avab ambitsioonikaid perspektiive.

14.01.25, 06:45
Kinnisvarasse investeerida tasub, väärismetallidesse samuti

2 eksperti kommenteerivad ja jagavad soovitusi

Võlakirjade ja aktsiate tootlus tajub taas ",,,"http://ct.moreover.com/?a=55882776262&p=1lk&v=1&x=307Avf0vYSRSiTaTOhqZPg","https://static-img.aripaev.ee/?type=preview&uuid=ca57ce39-d06b-5172-9a3d-3fea3f1e6817&width=1200&q=85",,ONLINE_NEWS,,"NOT AVAILABLE",Estonian,,,,,274,,Europe,Estonia,,,
01/28/2025,"04:01:41 AM",,,UTC,"Siim Sultson",Kinnisvarauudised.ee,"Magus investoriamps: laopindade nõudlus alles hakkab kasvama","Praegu veel on turg laopindade üürimise jaoks soodne, laopindade pakkumine on suurem ja hinnad konkurentsivõimelised. Ent see on peatselt pöördumas - astu kampa, kui julged. SIRIN Developmenti tegevjuhi Laurynas Kuzavas avab ambitsioonikaid...","SIRIN Developmenti tegevjuhi Laurynas Kuzavas avab ambitsioonikaid perspektiive.

Ärikinnisvara on muutumas järjest atraktiivsemaks. Üle nädala tagasi soovitas investor ja LHV nõukogu liige Raivo Hein investoritel, kes keskenduvad eluasemetele, kaalu...",,,"https://www.kinnisvarauudised.ee/uudised/2025/01/27/magus-investoriamps-laopindade-noudlus-alles-hakkab-kasvama",,,ONLINE_NEWS,,"NOT AVAILABLE",Estonian,,,,,75,,Europe,Estonia,,,
01/24/2025,"07:26:52 AM",,,UTC,,"Adaur.ee - Uudiste arhiiv","NORDIC REAL ESTATE FORUM 2025","We are excited to invite you to the Nordic Real Estate Forum 2025 – the premier gathering for real estate leaders across the Nordics and Baltics! Mark your calendar for March 20, 2025, at Tallinn Creative Hub in Estonia or join us online from anywhere in...","Forum Partners:

We’re proud to partner with Swedbank, NEWSEC, East Capital, Colonna Capital, Baltic Horizon Fund, SIRIN Development, Law Firm Glimstedt, and EuroPark.

Join us for a transformative day of learning, networking, and inspiration at Nord...",,,"https://www.adaur.ee/nordic-real-estate-forum-2025-2/","https://www.adaur.ee/wp-content/2025/01/LIVE-program-banner_postitus_23.01.25-900x900.jpg,https://www.adaur.ee/wp-content/2025/01/unnamed-900x247.jpg",,ONLINE_NEWS,,POSITIVE,English,,,,,599,,Europe,Estonia,,,
01/22/2025,"10:17:42 AM",,,UTC,"Sanne Taveter",Ärigeenius,"Baltimaade suurim logistikakinnisvara arendaja avas Eestis esimese logistikapargi ja investeerib 120 miljonit","Logistikakinnisvara arendaja SIRIN Development avas Tallinna külje all Sirin Park Tänassilma logisikapargi, mis märgib ettevõtte 120 miljoni euro suuruse investeerimiskava algust Eestis. 12 miljonit eurot maksnud ja 14 000 ruutmeetri suurune...","Logistikakinnisvara arendaja SIRIN Development avas Tallinna külje all Sirin Park Tänassilma logisikapargi, mis märgib ettevõtte 120 miljoni euro suuruse investeerimiskava algust Eestis.

12 miljonit eurot maksnud ja 14 000 ruutmeetri suurune logisti...",,,"https://ari.geenius.ee/rubriik/uudis/baltimaade-suurim-logistikakinnisvara-arendaja-avas-eestis-esimese-logistikapargi-ja-investeerib-120-miljonit/","https://geenius.ee/app/uploads/sites/17/2025/01/db5f76aa90ce33262ebba8bd5d77c52b.jpg",,ONLINE_NEWS,,"NOT AVAILABLE",Estonian,,950.0,38000,51,109,,Europe,Estonia,,,Tallinn
01/22/2025,"08:37:47 AM",,,UTC,Logistikauudised.ee,Logistikauudised.ee,"SIRIN Development avas Eestis oma esimese logistikapargi","12 miljonit eurot maksnud ja 14 000 ruutmeetri suurune SIRIN PARK TÄNASSILMA on jaanuarist üürnikele avatud. SIRIN Development käivitas sellega Eestis ambitsioonika investeerimiskava, mille raames plaanitakse 2030. aastaks investeerida kaasaegsete...","12 miljonit eurot maksnud ja 14 000 ruutmeetri suurune SIRIN PARK TÄNASSILMA on jaanuarist üürnikele avatud. SIRIN Development käivitas sellega Eestis ambitsioonika investeerimiskava, mille raames plaanitakse 2030. aastaks investeerida kaasaegsete lo...",,,"http://ct.moreover.com/?a=55831492336&p=1lk&v=1&x=_IQZZdb9Gd0ax-oCF1JqZQ","https://static-img.aripaev.ee/?type=preview&uuid=064a678b-d9a2-5408-8d4f-cd138355b29b&width=600&q=85,https://static-img.aripaev.ee/?type=preview&uuid=064a678b-d9a2-5408-8d4f-cd138355b29b&width=1200&q=85",,ONLINE_NEWS,,"NOT AVAILABLE",Estonian,,108.15,4326,31,36,,Europe,Estonia,,,Tallinn
01/22/2025,"08:12:33 AM",,,UTC,dv.ee,"Delovõje Vedomosti","Рядом с Таллинном открылся крупный логистический парк: это начало инвестиций объемом в 120 млн евро","Крупнейший в странах Балтии девелопер логистической недвижимости SIRIN Development открыл неподалеку от Таллинна логистический парк SIRIN Park Tänassilma, ознаменовав запуск в Эстонии инвестиционной программы объемом 120 миллионов евро, сообщила компания...","Крупнейший в странах Балтии девелопер логистической недвижимости SIRIN Development открыл неподалеку от Таллинна логистический парк SIRIN Park Tänassilma, ознаменовав запуск в Эстонии инвестиционной программы объемом 120 миллионов евро, сообщила комп...",,,"http://ct.moreover.com/?a=55831339765&p=1lk&v=1&x=Fl2RP53yr3Hhca6FKAsM1w","https://static-img.aripaev.ee/?type=preview&uuid=064a678b-d9a2-5408-8d4f-cd138355b29b&width=600&q=85,https://static-img.aripaev.ee/?type=preview&uuid=064a678b-d9a2-5408-8d4f-cd138355b29b&width=1200&q=85",,ONLINE_NEWS,,POSITIVE,Russian,,2312.5,92500,41,528,,Europe,Estonia,,,Tallinn
01/08/2025,"11:05:52 PM",,,UTC,,Baltija.eu,"Дума Риги отправила Вайводса в неоплачиваемый простой","После постановления суда Рижское самоуправление отправило ранее отстраненного от должности директора департамента внешнего пространства и мобильности Яниса Вайводса в неоплачиваемый простой. Как сообщил исполнительный директор столицы Янис Ланге, издано...","...проданы на аукционе 14 апреля 2022 года, и их за 5,7 млн евро приобрела компания ""Cella investment 3"", связанная с застройщиком ""Sirin Development"". Обе компании входят в литовскую холдинговую компанию ""ME Holding NT"". Литовский застройщик намерен по...",,,"https://baltija.eu/2025/01/09/dyma-rigi-otpravila-vaivodsa-v-neoplachivaemyi-prostoi/",,,ONLINE_NEWS,,NEUTRAL,Russian,,240.5,9620,44,534,,Europe,Estonia,,,
01/07/2025,"03:02:00 PM",,,UTC,"rus.tvnet.lv / LETA",Valgamaalane,"Обвиняемого в предложении взятки Вайводса отправили в неоплачиваемый простой","Директор департамента внешнего пространства и мобильности Янис Вайводс Фото: Edijs Pālens/LETA После постановления суда Рижское самоуправление отправило ранее отстраненного от должности директора департамента внешнего пространства и мобильности Яниса...","...проданы на аукционе 14 апреля 2022 года, и их за 5,7 млн евро приобрела компания Cella investment 3, связанная с застройщиком Sirin Development. Обе компании входят в литовскую холдинговую компанию ME Holding NT. Литовский застройщик намерен подать в...",,,"http://ct.moreover.com/?a=55718613599&p=1lk&v=1&x=tj2ARQNYdQegB0blNdSbgw","https://f12.pmo.ee/jGJBok29VOdNwoM0AQ409mz4Rik=/480x270/smart/nginx/o/2025/01/07/16582294t1h9afb.jpg",,ONLINE_NEWS,,POSITIVE,Russian,,29.68,1187,72,517,,Europe,Estonia,,,
01/06/2025,"11:05:07 AM",,,UTC,,Baltija.eu,"Суд обязал Рижскую думу восстановить в должности Яниса Вайводса","Латгальский районный суд постановил, что Рижская дума должна восстановить в должности бывшего директора думского департамента внешнего пространства и мобильности Яниса Вайводса, который обвиняется в предложении взятки. Суд удовлетворил встречный иск...","...проданы на аукционе 14 апреля 2022 года, и их за 5,7 млн евро приобрела компания ""Cella investment 3"", связанная с застройщиком ""Sirin Development"". Обе компании входят в литовскую холдинговую компанию ""ME Holding NT"". Литовский застройщик намерен по...",,,"http://ct.moreover.com/?a=55709405838&p=1lk&v=1&x=luxSYS6vfpbvxQMjvhLHmg","https://baltija.eu/wp-content/uploads/2025/01/8c31d185b5d0fc5a9da63262517b033a.jpg",,ONLINE_NEWS,,POSITIVE,Russian,,240.5,9620,44,454,,Europe,Estonia,,,
01/06/2025,"09:59:31 AM",,,UTC,"rus.tvnet.lv / LETA",Valgamaalane,"Суд обязал Рижскую думу восстановить в должности обвиняемого во взяточничестве Вайводса","Янис Вайводс Фото: Edijs Pālens/LETA Латгальский районный суд постановил, что Рижская дума должна восстановить в должности бывшего директора думского департамента внешнего пространства и мобильности Яниса Вайводса, который обвиняется в предложении...","...проданы на аукционе 14 апреля 2022 года, и их за 5,7 млн евро приобрела компания Cella investment 3, связанная с застройщиком Sirin Development. Обе компании входят в литовскую холдинговую компанию ME Holding NT. Литовский застройщик намерен подать в...",,,"http://ct.moreover.com/?a=55709006356&p=1lk&v=1&x=X_zXZVrZ8HEG0KBHxwbWwQ","https://f8.pmo.ee/1RHsJvar61O-KMLpaIE1EeDnB2E=/480x270/filters:focal(2434x234:4413x2617)/nginx/o/2024/12/15/16546939t1h8105.jpg",,ONLINE_NEWS,,POSITIVE,Russian,,29.68,1187,72,471,,Europe,Estonia,,,
01/04/2025,"03:23:30 PM",,,UTC,"Mario Maripuu","Eesti Eest!","The Telegraph võtab valgustada ülikoolides toimuvat Tühistamiskultuur ülikoolilinnakus: “Inimesed, keda ma polnud kunagi kohanud, tundsid mind kui “rassistlikku tüdrukut””","Suurbritannia tippülikoolide üliõpilased seisavad üha sagedamini silmitsi tsensuurikultuuriga, kuid mõned üliõpilased hakkavad vastu võitlema Kui Charlotte Tredgett võitis koha Londoni King’s College’is filosoofiat õppima, nägi särav ja entusiastlik...","“Mul järgnes ritsikate sirin [vaikus],” ütleb McKee, 44. “Keegi ei teadnud, mis see on, või kui teadis, ei tahtnud nad sellest rääkida. Kui ma sellest ühe oma õppejõuga rääkisin, rääkis ta lihtsalt sellest, et ülikool on kaasav keskkond. Ma mõtlesin:",,,"http://ct.moreover.com/?a=55698164311&p=1lk&v=1&x=MYQNJSGhoiKQKmyAqJECPQ","https://eestieest.com/wp-content/uploads/2025/01/TELEMMGLPICT000405945798_17350653861470_trans_NvBQzQNjv4BqNYNHpcO1X6eek6H_QvvN2x-3S8QfV0O5uk8ei_n_KEk.jpeg.webp",,ONLINE_NEWS,,"NOT AVAILABLE",Estonian,,,,,1067,,Europe,Estonia,,,
