Published Date,Published Time,Saved Date,Edited Date,Timezone,Author,Outlet,Headline,Coverage Snippet,Contextual Snippet,Insight Name,Insight,URL,Image URLs,Attribution,Media Type,Classification,Sentiment,Language,Translated Language,AVE(USD),Impressions,Domain Authority,Word Count,Duration,Continent,Country,Province/State,County,City
5/19/2025,7:22:20 AM,,,UTC,,Limon-postimees,Называет себя квиром: пять интересных фактов о победителе Евровидения-2025 Йоханнесе Пиче,"Победителем «Евровидения-2025» стал представитель Австрии Йоханнес Пич, которого коротко называют JJ. Он покорил еврофанов и жюри необычным номером: оперную арию он скомбинировал с техно- и электро-мотивами. Примечательно, что на создание этой композиции...",,,,https://limon.postimees.ee/8251661/nazyvaet-sebya-kvirom-pyat-interesnyh-faktov-o-pobeditele-evrovideniya-2025-yohannese-piche,http://f8.pmo.ee/eEDqiQCoU1PQ1IYg7kKQYWf53aY=/1442x0/filters:format(webp)/nginx/o/2025/05/19/16855804t1h4671.jpg,,ONLINE_NEWS,,POSITIVE,Russian,,632.63,25305,72,210,,Europe,Estonia,,,
5/14/2025,3:31:48 AM,,,UTC,,Pietiek,Vai deputāta kandidāts apzināti melo?,"Iesaki rakstu: CVK publicētā informācija liecina, ka A.Priediņš ir jurists ar maģistra grādu tiesību zinātnēs, tātad – likumdošanu pārzinošs cilvēks. 2020. gadā, kļūstot par zvērināta advokāta palīgu, A. Priediņa patrons bija zvērinātais advokāts un...",gada nogalē viņš Mārupes novada domes sēdē piedalījās kā SIA “Piche” pārstāvis (pēc tam vēl vairākkārt pārstāvējis uzņēmumu domes un komiteju sēdēs) un tajā pašā gadā sociālā vietnē “LinkedIn” sniedzis arī glaimojošu komentāru par šī uzņēmuma īpašnie...,,,https://pietiek.com/raksti/vai_deputata_kandidats_apzinati_melo/,"https://pietiek.com/img/illustr_lg/21196.jpg,img/illustr_lg/21196.jpg?v=21",,ONLINE_NEWS,,NOT AVAILABLE,Latvian,,1260.88,50435,41,519,,Europe,Latvia,,,
5/14/2025,3:19:19 AM,,,UTC,,m.pietiek.com,Vai deputāta kandidāts apzināti melo?,"Iesaki rakstu: Karā un mīlestībā visi līdzekļi mērķa sasniegšanai esot labi, bet vai tas ir pieļaujams, kandidējot vēlēšanās? Ja kandidāts slēpj būtiskus faktus, iesniedzot dokumentus Centrālajai vēlēšanu komisijai (CVK), viņš ir patoloģisks melis vai...",gada nogalē viņš Mārupes novada domes sēdē piedalījās kā SIA “Piche” pārstāvis (pēc tam vēl vairākkārt pārstāvējis uzņēmumu domes un komiteju sēdēs) un tajā pašā gadā sociālā vietnē “LinkedIn” sniedzis arī glaimojošu komentāru par šī uzņēmuma īpašnie...,,,https://m.pietiek.com/raksti/vai_deputata_kandidats_apzinati_melo/,//www.pietiek.com/img/illustr_lg/21196.jpg?v=21,,ONLINE_NEWS,,NOT AVAILABLE,Latvian,,0.25,10,,592,,Europe,Latvia,,,
4/14/2025,9:05:21 PM,,,UTC,Olafs Zvejnieks Latvijas Avīze,Latvijas Avīze,"""Piche"" valdes priekšsēdētājs Senkāns: Rīga attīstās, Mārupe regresē","Industriālo parku attīstītāja un apsaimniekotāja ""Piche"" valdes priekšsēdētājam un 95,31% akciju īpašniekam Pēterim Senkānam parasti vārds azotē jāmeklē nav. Viņš neslēpj, ka viņa gadiem ilgais bizness, kas bijis saistīts ar industriālo parku attīstību...","P. Senkāns: Tas drīzāk liecina par to, ka ir sasniegta zināma piesātinājuma pakāpe ""Piche"" attiecībās ar Mārupes novada domi un būvvaldi. Pēdējie četri gadi vispār nav bijuši vienkārši šajā ziņā, bet pēdējo pusotru gadu mums iet ļoti grūti ar būvvald...",,,https://lasi.lv/saimnieks-uznemejs/bizness/piche-valdes-priekssedetajs-senkans-riga-attistas-marupe-regrese.27386,https://media.lasi.lv/media/cache/gallery__jpeg/uploads/media/image/2025041420430667fd492a4192b.JPG,,ONLINE_NEWS,,NOT AVAILABLE,Latvian,,15192.05,607682,59,313,,Europe,Latvia,,,Riga
4/10/2025,1:18:42 PM,,,UTC,,BauskasDzive.lv,Industriālo parku attīstītājs “Piche” būvēs industriālo parku pie Bauska šosejas,"Industriālo parku attīstītājs “Piche” šogad sāks būvniecību sešos jaunajos projektos – trijos Mārupē, divos Dreiliņos un vienā Valdlaučos, kopējai investīciju summai sasniedzot 140 miljonus eiro, aģentūru LETA informēja kompānijā. Saturs turpināsies pēc...","Savukārt Mārupē “Piche” plāno attīstīt trīs jaunus industriālos parkus, izbūvējot telpas vairāk nekā 60 000 kvadrātmetru platībā.

Senkāns informē, ka pagājušajā gadā “Piche” industriālajos parkos uzņemti 60 jauni klienti. Šogad mērķis ir šo skaitu p...",,,http://ct.moreover.com/?a=56460927795&p=1lk&v=1&x=-UaiEN59lcWH7P96Ig2urA,https://bauskasdzive.lv/wp-content/uploads/2025/04/1594403328_Q4VKrheP.jpg,,ONLINE_NEWS,,NOT AVAILABLE,Latvian,,,,,234,,Europe,Latvia,,,
4/10/2025,6:29:45 AM,,,UTC,Delfi Bizness,Delfi Latvia,Piche инвестирует 130 миллионов в новые индустриальные парки,"Fоtо: Publicitātes foto Крупнейший в Латвии девелопер индустриальных парков Piche в этом году начинает строительство в шести новых проектах — трех в Марупе, двух в Дрейлини и одном в Валдлаучи, сообщили на предприятии. Общий объем инвестиций достигнет...","...в стратегическом месте рядом с магазином Ikea и логистическим центром Lidl.

В Валдлаучи, прямо у государственной дороги A7, Piche планирует развивать 35 000 м² индустриальных площадей.

В Марупе Piche планирует три новых индустриальных парка более ч...",,,http://ct.moreover.com/?a=56458229112&p=1lk&v=1&x=sBSlvmfkDqyUgGAccQlReg,https://images.delfi.lv/media-api-image-cropper/v1/0bc9a373-d9e3-4070-8b97-8481e885af1f.jpg?w=1200&h=628&r=16:9,,ONLINE_NEWS,,POSITIVE,Russian,,26902.8,1076112,83,290,,Europe,Latvia,,,Riga
4/9/2025,3:33:24 PM,,,UTC,,TV3 Latvia - Sākums,“Piche” investēs 140 miljonus eiro jaunos industriālajos parkos,"Industriālo parku attīstītājs “Piche” šogad sāks būvniecību sešos jaunajos projektos – trijos Mārupē, divos Dreiliņos un vienā Valdlaučos, kopējai investīciju summai sasniedzot 140 miljonus eiro, informē kompānijā. FOTO: PUBLICITĀTES FOTO Kopumā plānots...","Savukārt Mārupē “Piche” plāno attīstīt trīs jaunus industriālos parkus, izbūvējot telpas vairāk nekā 60 000 kvadrātmetru platībā.

Senkāns informē, ka pagājušajā gadā “Piche” industriālajos parkos uzņemti 60 jauni klienti. Šogad mērķis ir šo skaitu p...",,,https://zinas.tv3.lv/ekonomika/piche-investes-140-miljonus-eiro-jaunos-industrialajos-parkos/,"https://tv3cdn.lv/thumbnails/975x623xavif/2025/04/b148-67f692db99510.jpg,https://tv3cdn.lv/thumbnails/1200x630/2025/04/wm-b148-67f692db99510-i-default.jpg",,ONLINE_NEWS,,NOT AVAILABLE,Latvian,,,,,279,,Europe,Latvia,,,
4/9/2025,9:41:38 AM,,,UTC,Delfi Bizness,Delfi Latvia,"""Piche"" investēs 140 miljonus eiro jaunos industriālajos parkos","Latvijas lielākais industriālo parku attīstītājs ""Piche"" šogad uzsāk būvniecību sešos jaunajos projektos – trijos Mārupē, divos Dreiliņos un vienā Valdlaučos, informē uzņēmumā. ""Kopējā investīciju summa sasniedz 130 miljonus eiro, un plānots izbūvēt...","Valdlaučos, tieši pie valsts galvenā autoceļa A7, ""Piche"" plāno attīstīt 35 000 m² industriālās platības.

Mārupē ""Piche"" plāno attīstīt trīs jaunus industriālos parkus, izbūvējot vairāk nekā 60 000 m²

​""Pagājušajā gadā mūsu industriālajos parkos uz...",,,https://www.delfi.lv/bizness/55159262/nekustamais-ipasums/120068167/piche-investes-140-miljonus-eiro-jaunos-industrialajos-parkos,https://images.delfi.lv/media-api-image-cropper/v1/0bc9a373-d9e3-4070-8b97-8481e885af1f.jpg?w=1200&h=628&r=16:9,,ONLINE_NEWS,,NOT AVAILABLE,Latvian,,26902.8,1076112,83,301,,Europe,Latvia,,,Riga
4/9/2025,8:28:46 AM,,,UTC,,Dienas Bizness,Piche investē 140 miljonus eiro jaunos industriālajos parkos,"Latvijas lielākais industriālo parku attīstītājs Piche šogad uzsāk būvniecību sešos jaunajos projektos – trijos Mārupē, divos Dreiliņos un vienā Valdlaučos. ""Kopējā investīciju summa sasniedz 130 miljonus eiro, un plānots izbūvēt vairāk nekā 145 000 m²...","Latvijas lielākais industriālo parku attīstītājs Piche šogad uzsāk būvniecību sešos jaunajos projektos – trijos Mārupē, divos Dreiliņos un vienā Valdlaučos.

""Kopējā investīciju summa sasniedz 130 miljonus eiro, un plānots izbūvēt vairāk nekā 145 000",,,http://ct.moreover.com/?a=56449958829&p=1lk&v=1&x=tGQu56exUsrVy6deEv5mTA,https://cdntest.db.lv/lvold/1200/2019/articles/2025/04/520925__67f62942b8cc4.jpg,,ONLINE_NEWS,,NOT AVAILABLE,Latvian,,1969.4,78776,59,277,,Europe,Latvia,,,Riga
4/7/2025,8:44:54 AM,,,UTC,Laine Fedotova,LSM.lv,Mārupes pašvaldības lēmumi bremzē militāro preču ražošanas attīstību,"Nesaskaņās starp industriālo parku attīstītāju, uzņēmumu ""Piche"" un Mārupes novada būvvaldi par ķīlnieku kļuvis militāro preču ražotājs, uzņēmums ""Ammunity"". Tas šonedēļ palika bez biroja telpām, vēsta Latvijas Televīzijas raidījums ""De facto"".","Nesaskaņās starp industriālo parku attīstītāju, uzņēmumu ""Piche"" un Mārupes novada būvvaldi par ķīlnieku kļuvis militāro preču ražotājs, uzņēmums ""Ammunity"". Tas šonedēļ palika bez biroja telpām, vēsta Latvijas Televīzijas raidījums ""De facto"".",,,https://www.lsm.lv/raksts/zinas/ekonomika/06.04.2025-marupes-pasvaldibas-lemumi-bremze-militaro-precu-razosanas-attistibu.a594413/?utm_source=lsm&utm_medium=frontpage-theme-slider&utm_campaign=frontpage-theme-slider-4,https://static.lsm.lv/media/2022/07/large/2/ikgc.jpg,,ONLINE_NEWS,,NOT AVAILABLE,Latvian,,785.85,31434,80,31,,Europe,Latvia,,,Riga
4/7/2025,6:56:47 AM,,,UTC,,Delfi Latvia,Как латвийский производитель военных товаров оказался жертвой бюрократической неразберихи,"Fоtо: LETA Латвийское предприятие Ammunity, специализирующееся на выпуске малокалиберной амуниции, не может въехать в свой новый офис в Марупе. Компания оказалась заложником конфликта между застройщиком индустриального парка Piche и стройуправой...","...открытом пространстве"", — объясняет член правления Ammunity Беате Краузе-Чеботаре.

В чем проблема?

Компания арендовала помещения у Piche — девелопера, специализирующегося на строительстве и сдаче в аренду офисов и складов. Объект был сдан в эксплуа...",,,http://ct.moreover.com/?a=56432774645&p=1lk&v=1&x=Ai43j7qyqssoHHc8dh7vWw,"https://images.delfi.lv/media-api-image-cropper/v1/66053f20-5e83-11ed-aea5-671ec415b769.jpg?w=1764&h=992,https://images.delfi.lv/media-api-image-cropper/v1/66053f20-5e83-11ed-aea5-671ec415b769.jpg?w=1200&h=628&r=16:9",,ONLINE_NEWS,,NEUTRAL,Russian,,26902.8,1076112,83,627,,Europe,Latvia,,,Riga
4/7/2025,4:18:07 AM,,,UTC,Редакция Lsm,LSM.LV Russian,Производитель военных товаров — случайная жертва бюрократии,"Предприятие Ammunity — производитель товаров военного назначения — стало заложником разногласий между девелопером индустриального парка, компанией Piche, и стройуправой Маупского края, из-за которых оно не может въехать в свой новый офис.","Предприятие Ammunity — производитель товаров военного назначения — стало заложником разногласий между девелопером индустриального парка, компанией Piche, и стройуправой Маупского края, из-за которых оно не может въехать в свой новый офис.",,,https://rus.lsm.lv/statja/novosti/analitika/07.04.2025-proizvoditel-voennyx-tovarov-slucainaya-zertva-byurokratii.a594404/,https://static.lsm.lv/media/2025/03/large/1/q2fz.jpg,,ONLINE_NEWS,,POSITIVE,Russian,,0.25,10,,30,,Europe,Latvia,,,
4/6/2025,6:31:29 PM,,,UTC,София Солдатенко,Apollo.lv,Militāro preču ražotāji cieš no birokrātiskā sloga,"Nesaskaņās starp industriālo parku attīstītāju, uzņēmumu ""Piche"" un Mārupes novada Būvvaldi par ķīlnieku kļuvis militāro preču ražotājs, uzņēmums ""Ammunity"". Tas šonedēļ palika bez biroja telpām, vēsta Latvijas Televīzijas raidījums ""de facto"". Uzņēmumam...","...[projektu], vai uzliek kaut kādus kreizī (neadekvātus – red.) šķēršļus, principā uzņēmums pilnībā tiek paralizēts,” pauž SIA “Piche” valdes priekšsēdētājs Pēteris Senkāns.

Te gan ir būtiska detaļa – teikt, ka Mārupes novada Būvvalde lika šķēršļus ti...",,,https://www.apollo.lv/8224806/militaro-precu-razotaji-cies-no-birokratiska-sloga,"//f11.pmo.ee/2OcPgkXTUbtHBVb_ZaXO9j1TEls=/1442x0/filters:format(webp)/nginx/o/2024/08/27/16318989t1hb403.jpg,https://f11.pmo.ee/SATYiqM8170rM3dKdt3fkdLJcaI=/1200x630/filters:watermark(https://f.pmo.ee//logos/4132/d583334e07b643b158b745b655f05032.png,-2p,-2p,0,18,none):format(webp)/nginx/o/2024/08/27/16318989t1hb403.jpg",,ONLINE_NEWS,,NOT AVAILABLE,Latvian,,9197.77,367911,55,1115,,Europe,Latvia,,,Riga
4/6/2025,6:12:02 PM,,,UTC,,Valgamaalane,Решения Марупского края задерживают возобновление производства военных товаров,Амуниция. Иллюстративное фото Фото: Schutterstock.com В результате разногласий между застройщиком индустриального парка - предприятием Piche - и стройуправой Марупского края заложником стал производитель военных товаров - предприятие Ammunity. Оно на...,"...согласно нуждам клиента необходимо построить помещения меньшего размера и санузлы. Поэтому 14 марта, сразу же после того, как Piche сдало в эксплуатацию переделанные для предприятия помещения, оно подало в стройуправу Марупского края проект перестрой...",,,http://ct.moreover.com/?a=56429494209&p=1lk&v=1&x=6wM1e9w1eBFjhUvdOzIfpw,https://f11.pmo.ee/Hqc65ZqJb-Vs03xLLjMUOmcbxnk=/480x270/smart/nginx/o/2025/04/06/16760029t1h34b9.jpg,,ONLINE_NEWS,,POSITIVE,Russian,,29.68,1187,72,1163,,Europe,Estonia,,,
4/6/2025,6:11:18 PM,,,UTC,Ева Ойжинская,TVNET,Решения Марупского края задерживают возобновление производства военных товаров,"В результате разногласий между застройщиком индустриального парка - предприятием Piche - и стройуправой Марупского края заложником стал производитель военных товаров - предприятие Ammunity. Оно на этой неделе осталось без офисных помещений, сообщает...","...согласно нуждам клиента необходимо построить помещения меньшего размера и санузлы. Поэтому 14 марта, сразу же после того, как Piche сдало в эксплуатацию переделанные для предприятия помещения, оно подало в стройуправу Марупского края проект перестрой...",,,https://rus.tvnet.lv/8224827/resheniya-marupskogo-kraya-zaderzhivayut-vozobnovlenie-proizvodstva-voennyh-tovarov,"https://f11.pmo.ee/HgKypMW_FtAKDzK1pdiblG5DjV0=/1200x630/filters:watermark(https://f.pmo.ee//logos/4157/4f65a0ca1fa521e51f6438e24b2258a6.png,-2p,-2p,0,18,none):format(webp)/nginx/o/2025/04/06/16760029t1h34b9.jpg,//f11.pmo.ee/EhMiXJgA1_OQgrmS99wxcpigHIo=/1442x0/filters:format(webp)/nginx/o/2025/04/06/16760029t1h34b9.jpg",,ONLINE_NEWS,,NOT AVAILABLE,Latvian,,20507.25,820290,67,1158,,Europe,Latvia,,,Riga
4/6/2025,6:06:11 PM,,,UTC,,Neatkarīgā Rīta Avīze,Raidījums: militāro preču ražošanas attīstība Mārupē kavējas domes lēmumu dēļ,"Nesaskaņās starp industriālo parku attīstītāju, uzņēmumu “Piche” un Mārupes novada Būvvaldi par ķīlnieku kļuvis militāro preču ražotājs, uzņēmums “Ammunity”. Tas šonedēļ palika bez biroja telpām, vēsta Latvijas Televīzijas raidījums “de facto”. Uzņēmumam...","...[projektu], vai uzliek kaut kādus kreizī (neadekvātus - red.) šķēršļus, principā uzņēmums pilnībā tiek paralizēts,” pauž SIA “Piche” valdes priekšsēdētājs Pēteris Senkāns.

Mārupes novada Būvvalde lēmuma pieņemšanu atlika par gandrīz četriem mēnešiem...",,,https://nra.lv/latvija/487648-raidijums-domes-lemumu-del-kavejas-militaro-precu-razosanas-attistiba-marupe.htm,https://zinas.nra.lv/_mm/photos/2025-04/1440px/740804_4a475e6587.jpg,,ONLINE_NEWS,,NOT AVAILABLE,Latvian,,9961.03,398441,55,614,,Europe,Latvia,,,Riga
4/6/2025,6:05:08 PM,,,UTC,,TVNET,Mārupes pašvaldības lēmumi kavē militāro preču ražošanas uzsākšanu,"Nesaskaņās starp industriālo parku attīstītāju, uzņēmumu “Piche” un Mārupes novada Būvvaldi par ķīlnieku kļuvis militāro preču ražotājs, uzņēmums “Ammunity”. Tas šonedēļ palika bez biroja telpām, vēsta Latvijas Televīzijas raidījums “de facto”. [embedded...","...[projektu], vai uzliek kaut kādus kreizī (neadekvātus – red.) šķēršļus, principā uzņēmums pilnībā tiek paralizēts,” pauž SIA “Piche” valdes priekšsēdētājs Pēteris Senkāns.

Te gan ir būtiska detaļa – teikt, ka Mārupes novada Būvvalde lika šķēršļus ti...",,,http://ct.moreover.com/?a=56429469605&p=1lk&v=1&x=sXU-Jn5T9PuVBgopSuq5SQ,,,ONLINE_NEWS,,NOT AVAILABLE,Latvian,,20507.25,820290,67,1117,,Europe,Latvia,,,Riga
4/6/2025,5:55:16 PM,,,UTC,Ева Ойжинская,TVNET,Mārupes pašvaldības lēmumi kavē militāro preču ražošanas uzsākšanu,"Nesaskaņās starp industriālo parku attīstītāju, uzņēmumu “Piche” un Mārupes novada Būvvaldi par ķīlnieku kļuvis militāro preču ražotājs, uzņēmums “Ammunity”. Tas šonedēļ palika bez biroja telpām, vēsta Latvijas Televīzijas raidījums “de facto”. Uzņēmumam...","...[projektu], vai uzliek kaut kādus kreizī (neadekvātus – red.) šķēršļus, principā uzņēmums pilnībā tiek paralizēts,” pauž SIA “Piche” valdes priekšsēdētājs Pēteris Senkāns.

Te gan ir būtiska detaļa – teikt, ka Mārupes novada Būvvalde lika šķēršļus ti...",,,https://www.tvnet.lv/8224802/marupes-pasvaldibas-lemumi-kave-militaro-precu-razosanas-uzsaksanu,"//f7.pmo.ee/ojP8B3LV_Zj-2q4kW32KlVnqlcw=/1442x0/filters:format(webp)/nginx/o/2025/04/06/16760262t1he7b6.jpg,https://f7.pmo.ee/czL_qcgvYqFBxTo1djXev1tRuOY=/1200x630/filters:watermark(https://f.pmo.ee//logos/4133/bb989514d16b88b940b51f02e07642d0.png,-2p,-2p,0,18,none):format(webp)/nginx/o/2025/04/06/16760262t1he7b6.jpg",,ONLINE_NEWS,,NOT AVAILABLE,Latvian,,20507.25,820290,67,1115,,Europe,Latvia,,,Riga
4/6/2025,5:31:39 PM,,,UTC,Laine Fedotova,LSM.lv,Mārupes pašvaldības lēmumi bremzē militāro preču ražošanas attīstību,"Nesaskaņās starp industriālo parku attīstītāju, uzņēmumu ""Piche"" un Mārupes novada Būvvaldi par ķīlnieku kļuvis militāro preču ražotājs, uzņēmums ""Ammunity"". Tas šonedēļ palika bez biroja telpām, vēsta Latvijas Televīzijas raidījums ""de...","...[projektu], vai uzliek kaut kādus kreizī (neadekvātus – red.) šķēršļus, principā uzņēmums pilnībā tiek paralizēts,"" pauda SIA ""Piche"" valdes priekšsēdētājs Pēteris Senkāns.

Te gan ir būtiska detaļa – teikt, ka Mārupes novada Būvvalde lika šķēršļus t...",,,https://www.lsm.lv/raksts/zinas/ekonomika/06.04.2025-marupes-pasvaldibas-lemumi-bremze-militaro-precu-razosanas-attistibu.a594413/,https://static.lsm.lv/media/2022/07/large/2/ikgc.jpg,,ONLINE_NEWS,,NOT AVAILABLE,Latvian,,785.85,31434,80,1124,,Europe,Latvia,,,Riga
3/12/2025,4:36:24 AM,,,UTC,,Travel News.lv,12. marts vēsturē: «airBaltic» Pilotu akadēmija atklāj jauno lidmašīnu angāru Liepājā,"Foto: airBaltic.com Autors: Jānis Pēteris Bērziņš Avots: BalticTravelnews.com/airBaltic.com airBaltic Training Liepājā 2020. gada 12. martā, kopā ar Latvijas Republikas Valsts prezidentu Egilu Levitu un lidsabiedrības partneriem svinīgi atklāja jauno...","Angāra celtniecību īstenoja būvfirma PICHE un tas ekspluatācijā tika nodots 2020. gada 10. februārī.

Vairāk par Pilotu akadēmiju un tās piedāvājumiem var uzzināt šeit.

Par rakstu pārpublicēšanas noteikumiem lūdzam kontaktēties ar Travelnews.lv reda...",,,http://ct.moreover.com/?a=56227518251&p=1lk&v=1&x=1Avz8EtGS2_4efzJp5DALQ,https://travelnews.lv/images/2024-DzesamaFotoMape/20250312-Angars.jpg,,ONLINE_NEWS,,NOT AVAILABLE,Latvian,,,,,93,,Europe,Latvia,,,
3/12/2025,4:05:26 AM,,,UTC,,Travelnews.lv - Akcijas & Svētki,"12. marts vēsturē: «airBaltic» Pilotu akadēmija atklāj jauno lidmašīnu angāru Liepājā ĪSTS VIDUSLAIKU RAUTS UN DANČI ""Pavasara danči"" TDA ""Svīta"" lielkoncerts Kas jauns Tukumā? Ekskursijas Kodolraķešu bāzē Zeltiņos 2025","airBaltic Training Liepājā 2020. gada 12. martā, kopā ar Latvijas Republikas Valsts prezidentu Egilu Levitu un lidsabiedrības partneriem svinīgi atklāja jauno lidmašīnu angāru, kura celtniecība tika uzsākta 2019. gada augustā. Kopējā jaunā lidmašīnu...","Angāra celtniecību īstenoja būvfirma PICHE un tas ekspluatācijā tika nodots 2020. gada 10. februārī.

Vairāk par Pilotu akadēmiju un tās piedāvājumiem var uzzināt šeit

Par rakstu pārpublicēšanas noteikumiem lūdzam kontaktēties ar Travelnews.lv redak...",,,https://travelnews.lv/?m_id=18526&i_id=5&pub_id=149124&12-marts-vesture:-airBaltic-Pilotu-akademija-atklaj-jauno-lidmasinu-angaru-Liepaja,"https://travelnews.lv/images/2024-DzesamaFotoMape/20250312-Angars.jpg,images/../images/2024-DzesamaFotoMape/20250312-Angars.jpg",,ONLINE_NEWS,,NOT AVAILABLE,Latvian,,0.25,10,,148,,Europe,Latvia,,,
3/5/2025,3:43:35 PM,,,UTC,,Dienas Bizness,Colliers: Pērn darījumi ar komercīpašumiem Latvijā veikti par 133 miljoniem eiro,"Pērn darījumi ar komercīpašumiem Latvijā veikti par 133 miljoniem eiro, un tas bijis sliktākais gads vēsturē, trešdien ""Baltic Real Estate Leaders Breakfast"" pasākumā sacīja nekustamo īpašumu konsultāciju kompānijas ""Colliers Baltics"" Izpētes un...","""Colliers Baltic"" partneris un Industriālo platību un loģistikas aģentūras vadītājs Kaspars Gražulis sacīja, ka Latvijas tirgū industriālo platību attīstību veic pārsvarā trīs attīstītāji - ""VGP"", ""Piche"" un ""Sirin Development"", kuri katru gadu telpu",,,http://ct.moreover.com/?a=56174523004&p=1lk&v=1&x=-O2EkeOihoQ-3WCtjUV5aA,https://cdntest.db.lv/lvold/1200/2019/articles/2025/03/520370__67c83e8d305ed.jpg,,ONLINE_NEWS,,NOT AVAILABLE,Latvian,,1969.4,78776,59,625,,Europe,Latvia,,,Riga
3/1/2025,10:03:04 PM,,,UTC,Ingrīda Drazdovska,Delfi Latvia,Īpašumu attīstītājs domei velta piktus video. Pamatota kritika vai priekšvēlēšanu antikampaņa?,"Ar vēlējumiem ""Mārupes čūskiņām un čūsku dīdītājam"" beidzot sākt strādāt novada un Latvijas labā sveicienus Mārupes novada pašvaldībai februāra sākumā sagādāja viens no lielākajiem tā uzņēmumiem – nekustamā īpašuma attīstītājs ""Piche"", ar košiem šī...","Ar vēlējumiem ""Mārupes čūskiņām un čūsku dīdītājam"" beidzot sākt strādāt novada un Latvijas labā sveicienus Mārupes novada pašvaldībai februāra

sākumā sagādāja viens no lielākajiem tā uzņēmumiem – nekustamā īpašuma attīstītājs ""Piche"", ar košiem šī ",,,https://www.delfi.lv/bizness/37264250/biznesa_vide/120063214/ipasumu-attistitajs-domei-velta-piktus-video-pamatota-kritika-vai-prieksvelesanu-antikampana,"https://images.delfi.lv/media-api-image-cropper/v1/dcfdf5ac-5727-4826-b12f-c72a2fcf6710.jpg?w=576&h=324&r=16:9,https://images.delfi.lv/media-api-image-cropper/v1/dcfdf5ac-5727-4826-b12f-c72a2fcf6710.jpg?w=1200&h=628&r=16:9",,ONLINE_NEWS,,NOT AVAILABLE,Latvian,,26902.8,1076112,83,146,,Europe,Latvia,,,Riga
