Published Date,Author,Outlet,Headline,Contextual Snippet,URL,Sentiment,AVE(USD),Impressions,Country
2025-11-04 00:00:00,Mykhailo Sapiton,investinestonia.com,Tech Group named Estonia’s Company of the Year 2025 — Invest in Estonia,"LHV Pank claimed the top spot among financial intermediaries, Kapitel won in both real estate and overall commercial services, and Tornator Eesti led agriculture, forestry, and fisheries.",https://investinestonia.com/tech-group-named-estonias-company-of-the-year-2025/,Positive,285.2,30832.0,Estonia
2025-11-01 00:00:00,Aivar Pau,новости ERR,Предприятием года признали технологическую компанию Tech Group,"Помимо Tech Group, на титул ""предприятие года"" также претендовали Tiksoja Puidugrupp, Pactum AI, Akzo Nobel Baltics, Elamus Spa, Pro Optika, Foxway, LTH-Baas, Tavid и Kapitel.

Молодым предпринимателем года был признан владелец K-Print Райт Ребане.",https://rus.err.ee/1609845483/predprijatiem-goda-priznali-tehnologicheskuju-kompaniju-tech-group,,3832.0,414270.0,Estonia
2025-11-01 00:00:00,Aivar Pau,Estonian Public Broadcasting,Galerii: Aasta ettevõte 2025 on kõrgtehnoloogiaettevõte Tech Group,"aasta innovaator Pactum AI

aasta kestlik ettevõte Akzo Nobel Baltics

aasta turismiedendaja Elamus Spa

aasta pereettevõte Pro Optika

aasta välisinvestor Foxway

konkurentsivõimelisim tööstusettevõte LTH-Baas

konkurentsivõimelisim kaubandusettevõte Tavid

konkurentsivõimelisim teenindusettevõte Kapitel",https://www.err.ee/1609845474/galerii-aasta-ettevote-2025-on-korgtehnoloogiaettevote-tech-group,,1752.47,189456.0,Estonia
2025-11-01 00:00:00,Tanel Saarmann,Ärileht,FOTOD | Aasta ettevõte 2025 on kõrgtehnoloogiaettevõte Tech Group. Kes veel auhindu võitsid?,"aasta innovaator Pactum AI

aasta kestlik ettevõte Akzo Nobel Baltics

aasta turismiedendaja Elamus Spa

aasta pereettevõte Pro Optika

aasta välisinvestor Foxway

konkurentsivõimelisim tööstusettevõte LTH-Baas

konkurentsivõimelisim kaubandusettevõte Tavid

konkurentsivõimelisim teenindusettevõte Kapitel",https://arileht.delfi.ee/artikkel/120414164/fotod-aasta-ettevote-2025-on-korgtehnoloogiaettevote-tech-group-kes-veel-auhindu-voitsid,,2752.48,297565.0,Estonia
2025-11-01 00:00:00,Tanel Saarmann,Ärileht,OTSEFOTOD | Eesti ettevõtluseliit pidutseb ja jagatakse auhindu. Tänaku osalusega spa võitis tiitli,"kestlikkuse edendaja Akzo Nobel Baltics

 

aasta turismiedendaja Elamus Spa

 

aasta pereettevõte Pro Optika

 

aasta välisinvestor Foxway

 

aasta konkurentsivõimelisim tööstusettevõte LTH-Baas

 

aasta konkurentsivõimelisim kaubandusettevõte Tavid

 

aasta konkurentsivõimelisim teenindusettevõte Kapitel",https://arileht.delfi.ee/artikkel/120414302/otsefotod-eesti-ettevotluseliit-pidutseb-ja-jagatakse-auhindu-tanaku-osalusega-spa-voitis-tiitli,,2752.48,297565.0,Estonia
2025-11-01 00:00:00,Tanel Saarmann,Ärileht,"FOTOD | Eesti ettevõtluseliit pidutseb ja jagatakse auhindu. Vaata, kes on kohale tulnud","Pactum AI

aasta kestlikkuse edendaja Akzo Nobel Baltics

aasta turismiedendaja Elamus Spa

aasta pereettevõte Pro Optika

aasta välisinvestor Foxway

aasta konkurentsivõimelisim tööstusettevõte LTH-Baas

aasta konkurentsivõimelisim kaubandusettevõte Tavid

aasta konkurentsivõimelisim teenindusettevõte Kapitel",https://arileht.delfi.ee/artikkel/120414302/fotod-eesti-ettevotluseliit-pidutseb-ja-jagatakse-auhindu-vaata-kes-on-kohale-tulnud,,2752.48,297565.0,Estonia
2025-11-01 00:00:00,,Ärileht,VIDEO | Aasta teenindusäri tõi Tallinna uue Kuu,"Kapitel on üks kümnest ettevõttest, mis võistleb tiitlile „Aasta ettevõte 2025“.",https://arileht.delfi.ee/artikkel/120414138/video-aasta-teenindusari-toi-tallinna-uue-kuu,,2752.48,297565.0,Estonia
