Published Date,Outlet,Headline,Contextual Snippet,URL
2/28/2025,Stena,"Старые, требующие ремонта, квартиры в Таллинне разлетаются, как пирожки","...сократились почти на 45%, в то время как вторичный рынок, наоборот, показал рост на 20%. По словам аналитика агентства недвижимости Restate Юлии Линде, флипперы буквально охотятся за выгодными предложениями.

«Если объявление о продаже квартиры в пан...",https://www.stena.ee/blog/starye-trebuyuschie-remonta-kvartiry-v-tallinne-razletayutsya-kak-pirozhki
2/26/2025,Err.ee - Rus,Нуждающиеся в ремонте квартиры в панельных домах Таллинна находят покупателя за пару часов,"...упали почти на 45%, а продажи квартир на вторичном рынке за тот же период выросли почти на 20%. Аналитик фирмы по недвижимости Restate Юлия Линде пояснила, что флипперы в прямом смысле слова охотятся за нуждающимися в ремонте квартирами в панельных д...",http://ct.moreover.com/?a=56116132234&p=1lk&v=1&x=FVCjcSRS4rFvBKnZ1sVTrg
2/22/2025,Äripäev,Raadiohitid: Oleg Grossi läbilöök ja Liis Lassi portfell,"Teatud turusegmenti on üsna aktiivselt juba mõjutamas flippijad.Turu aktiivsuse kasvu kirjeldab saate teise poole alguses kinnisvarafirma Restate analüütik Julia Linde, kes toob välja, et külgsuunas liikuval kinnisvaraturul tegutsevad taaskord üsna a...",http://ct.moreover.com/?a=56086771828&p=1lk&v=1&x=7rnkzsAg2lDHWsVNgdihrw
2/20/2025,Äripäev,"Hinnakasv kinnisvaras inflatsiooni veel ei löö, aga üht-teist teha juba annab","Turu aktiivsuse kasvu kirjeldab saate teise poole alguses kinnisvarafirma Restate analüütik Julia Linde, et toob välja, et külgsuunas liikuval kinnisvaraturul tegutsevad taaskord üsna aktiivselt flippijad, kes noolivad kindlat tüüpi kortereid, mis ju...",http://ct.moreover.com/?a=56068744927&p=1lk&v=1&x=EwAm-MW2i1heWgIrkTf5rQ
2/20/2025,Äripäev,"Kinnisvara hinnatõus inflatsiooni veel ei löö, aga juba annab üht-teist teha","Turu aktiivsuse kasvu kirjeldab saate teise poole alguses kinnisvarafirma Restate analüütik Julia Linde. Ta toob välja, et külgsuunas liikuval kinnisvaraturul tegutsevad taaskord üsna aktiivselt flippijad, kes noolivad kindlat tüüpi kortereid, mis ti...",http://ct.moreover.com/?a=56068630866&p=1lk&v=1&x=ZCoYBexesXdAIf4xHQPFxQ
2/19/2025,Äripäev,"Raadiohommikus: Tallinki tulemused, Trumpi himud ja parim seadus","Teemat avavad analüütikud Igor Habal Uus Maast ning Julia Linde Restate Kinnisvarast. Saatejuht on Lauri Leet.

Kuulake Äripäeva raadiot Tallinnas ja Harjumaal 92,4 MHz, Tartus 97,7 MHz, Pärnus 91,9 MHz, Haapsalus 96,0 MHz, Saaremaal 101,7 MHz, Ida-V...",http://ct.moreover.com/?a=56062206897&p=1lk&v=1&x=OanguAF6zBCT4z97se0Nyg
2/17/2025,Äripäev,"Julia Linde: paneelmajade korterite peale käib rebimine, flippijad platsis","Korteriturgu hoiavad praegu aktiivsena hinnatundlikud ostjad, kirjutab kinnisvarafirma Restate analüütik Julia Linde.

Kas mäletate mõne aasta tagust olukorda kinnisvaraturul, kus kodu ostuotsus tuli teha väga kiiresti ning teha ülepakkuminegi, et mi...",https://www.aripaev.ee/arvamused/2025/02/17/julia-linde-paneelmajade-korterite-peale-kaib-rebimine-flippijad-platsis
